Nom,Lien,Financeurs,Bénéficiaire,Types d'aides,AAP/AMI,Récurrence,Descriptif,Date Clôture
Etre aidé dans la mise en oeuvre des villes et territoires durables,https://aides-territoires.beta.gouv.fr/aides/88ff-copie-08h34-etre-aide-pour-batir-des-strategi/,Agences d'urbanisme,"Communes;Intercommunalités / Pays;Départements;Régions;Entreprises privées;Entreprises publiques locales (Sem, Spl, SemOp);Établissements publics (écoles, bibliothèques…) / Services de l'État;Recherche",Ingénierie technique,,Permanente,"Les agences d'urbanisme vous aident dans la mise en oeuvre des villes et territoires durables                  Mettre en œuvre des villes et territoires durables, c'est penser leur développement de manière transversale et intégrée à différentes échelles, pour faire face aux transitions. C'est faire appel à des modes plus coopératifs et participatifs pour impliquer l'ensemble des acteurs du territoire. C'est aborder les projets dans toutes leurs dimensions : physiques, environnementales, économiques et sociales. Dans ce contexte, un outil d'ingénierie tel que l'agence d'urbanisme constitue un atout important. Par son approche transversale et multi-acteurs, l'agence d'urbanisme permet de rompre avec les approches sectorielles. Elle offre la possibilité de construire une vision stratégique articulant les différentes échelles des territoires et de mieux articuler les politiques publiques, comme celles de l'habitat, de la solidarité, des projets urbains, de l'environnement ou encore de la mobilité.                Les agences d'urbanisme             Les agences d'urbanisme sont des outils d'ingénierie innovants, fondés sur le partenariat.      Depuis 50 ans, leur gouvernance et leurs missions se sont réinventées pour anticiper les différentes étapes de la décentralisation et des politiques d'aménagement du territoire et mettre en œuvre les projets territoriaux.                Des outils au service de l'intérêt général             Les agences d'urbanisme sont des associations loi 1901. Le conseil d'administration ou le bureau pilote la stratégie ; l'assemblée générale, elle, est l'organe décisionnel. Celle-ci se compose des représentants de tous les membres de l'association. Ils forment le cœur du partenariat. Les membres sont :    - les collectivités locales et leurs groupements (communes et intercommunalités de tailles variées, départements, régions, syndicats mixtes), représentés par des élus ;    - l'Etat, représenté notamment par le préfet ou le sous-préfet, et la DREAL ou la DDT(M) ;    - des acteurs territoriaux du monde économique (chambre consulaire, port...), de l'énergie, de l'habitat, de l'environnement, de l'enseignement supérieur (universités...) ;    - et des membres associés intéressés par les enjeux territoriaux.                Le programme partenarial : une feuille de route mutualisée entre les membres et les financeurs             Les agences d'urbanisme accompagnent les politiques publiques afin de contribuer à l'aménagement et au développement durable de leur territoire, dans un souci de cohérence des politiques publiques. Le contenu des missions est discuté et élaboré en commun, avec les membres de l'agence, et formalisé dans une feuille de route d'actions mutualisées, nommé « programme partenarial » et adopté par les instances de l'agence.    Les agences d'urbanisme, par ce mode de fonctionnement, offrent un espace de travail, de dialogue et de neutralité entre les acteurs. Les travaux produits dans le cadre du programme partenarial sont accessibles à tous les membres et financeurs.                Une équipe pluridisciplinaire et inclusive             La pluridisciplinarité est un marqueur fort et très distinctif de l'offre et du fonctionnement des agences d'urbanisme. Peu d'organismes concentrent en leur sein un tel éventail de compétences. Les collaborateurs et collaboratrices aux métiers très divers croisent leurs expertises dans les domaines de l'habitat et du foncier, de l'économie territoriale et du commerce, de la cohésion sociale, de l'environnement, ou encore de l'énergie et des mobilités... Une plus-value rare au service de l'efficacité des projets de territoire, de la pertinence des analyses et de l'optimisation des coûts qui permet aux agences d'urbanisme de mettre en œuvre leur programme partenarial, en lien avec les acteurs de terrain.",
"Etre aidé dans la réalisation d’actions culturelles sur la construction, l'architecture, urbanisme, le paysage et l'environnement",https://aides-territoires.beta.gouv.fr/aides/0b95-copie-12h28-etre-aide-dans-la-realisation-dac/,Conseil architecture urbanisme environnement (CAUE),"Communes;Intercommunalités / Pays;Départements;Régions;Collectivités d'outre-mer à statuts particuliers;Associations;Particuliers;Agriculteurs;Entreprises privées;Entreprises publiques locales (Sem, Spl, SemOp);Établissements publics (écoles, bibliothèques…) / Services de l'État;Recherche",Ingénierie technique,,Permanente,"Acteurs de la culture, les CAUE sont des centres de ressources, source de pédagogie et d'outils de sensibilisation.        Présents depuis plus de 40 ans, ils mettent à disposition leurs connaissances des territoires et de leurs mutations. Ils produisent des     outils et des actions à vocation éducative ou culturelle et vous accompagnent dans vos projets.        Ils s'adressent aux élus, au jeune public (en milieu scolaire, périscolaire et  autres), aux étudiants, au grand public, aux professionnels, aux services de l'Etat.      Leurs équipes sont pluridisciplinaires et œuvrent au quotidien sur le terrain. Elles peuvent vous accompagner dans des démarches expérimentales, innovantes.         La palette de leurs interventions est multiple :           Apport de données et d'informations       Atlas de paysages, observatoires       Ateliers, conférences, journées de sensibilisation       Visites de sites, voyage d'études, randonnées, lectures de paysages       Rendez-vous culturels       Organisation et réalisation de prix, palmarès, concours, appels à idées       Réalisation de plaquettes, ouvrages, guides, vidéos, expositions       Participation à des commissions techniques thématiques (commerce, agriculture...)       Actions pédagogiques en milieu scolaire et hors ce milieu",
Etre aidé pour participer au débat territorial,https://aides-territoires.beta.gouv.fr/aides/f7b7-copie-13h16-etre-aide-pour-batir-des-strategi/,Agences d'urbanisme,"Communes;Intercommunalités / Pays;Départements;Régions;Entreprises privées;Entreprises publiques locales (Sem, Spl, SemOp);Établissements publics (écoles, bibliothèques…) / Services de l'État;Recherche",Ingénierie technique,,Permanente,"Les agences d'urbanisme aident à sensibiliser et animer le débat territorial         L'agence d'urbanisme, grâce à son positionnement partenarial et sa neutralité est un connecteur entre les acteurs. Forte de cela et de son ancrage, elle a un rôle d'animation territoriale pour lequel elle développe des activités et des méthodes participatives innovantes.    L'agence s'appuie à la fois sur son expertise et sur sa compétence d'animation pour être moins dans la « confrontation territoriale » mais plus dans la co-construction.             Les agences d'urbanisme         Les agences d'urbanisme sont des outils d'ingénierie innovants, fondés sur le partenariat.    Depuis 50 ans, leur gouvernance et leurs missions se sont réinventées pour anticiper les différentes étapes de la décentralisation et des politiques d'aménagement du territoire et mettre en œuvre les projets territoriaux.           Des outils au service de l'intérêt général         Les agences d'urbanisme sont des associations loi 1901. Le conseil d'administration ou le bureau pilote la stratégie ; l'assemblée générale, elle, est l'organe décisionnel. Celle-ci se compose des représentants de tous les membres de l'association. Ils forment le cœur du partenariat. Les membres sont :    les collectivités locales et leurs groupements (communes et intercommunalités de tailles variées, départements, régions, syndicats mixtes), représentés par des élus ;    l'état, représenté notamment par le préfet ou le sous-préfet, et la DREAL ou la DDT(M) ;    des acteurs territoriaux du monde économique (chambre consulaire, port...), de l'énergie, de l'habitat, de l'environnement, de l'enseignement supérieur (universités...) ;    et des membres associés intéressés par les enjeux territoriaux.             Le programme partenarial : une feuille de route mutualisée entre les membres et les financeurs         Les agences d'urbanisme accompagnent les politiques publiques afin de contribuer à l'aménagement et au développement durable de leur territoire, dans un souci de cohérence des politiques publiques. Le contenu des missions est discuté et élaboré en commun, avec les membres de l'agence, et formalisé dans une feuille de route d'actions mutualisées, nommé « programme partenarial » et adopté par les instances de l'agence.    Les agences d'urbanisme, par ce mode de fonctionnement, offrent un espace de travail, de dialogue et de neutralité entre les acteurs. Les travaux produits dans le cadre du programme partenarial sont accessibles à tous les membres et financeurs.           Une équipe pluridisciplinaire et inclusive         La pluridisciplinarité est un marqueur fort et très distinctif de l'offre et du fonctionnement des agences d'urbanisme. Peu d'organismes concentrent en leur sein un tel éventail de compétences. Les collaborateurs et collaboratrices aux métiers très divers croisent leurs expertises dans les domaines de l'habitat et du foncier, de l'économie territoriale et du commerce, de la cohésion sociale, de l'environnement, ou encore de l'énergie et des mobilités... Une plus-value rare au service de l'efficacité des projets de territoire, de la pertinence des analyses et de l'optimisation des coûts qui permet aux agences d'urbanisme de mettre en œuvre leur programme partenarial, en lien avec les acteurs de terrain.",
Etre conseillé par un cadre expert de la DGFiP au niveau local (CDL),https://aides-territoires.beta.gouv.fr/aides/310c-copie-10h15-etre-conseille-sur-des-sujets-com/,Direction Générale des Finances Publiques (DGFiP),Communes;Intercommunalités / Pays,Ingénierie financière,,Permanente,"Conseiller aux décideurs locaux (CDL)        Le conseiller aux décideurs locaux (CDL) est un cadre de la Direction générale des Finances publiques (DGFiP), expert du conseil au profit des élus locaux et de leurs services financiers. Il propose une offre de conseil individualisé aux ordonnateurs pour répondre à leurs besoins sur différents sujets. Il est rattaché à la direction départementale ou régionale des Finances publiques.      La création de cette fonction s'inscrit dans le cadre du nouveau réseau de proximité mis en place par la DGFiP en 2020 pour renforcer sa présence dans les territoires. Son déploiement est prévu jusqu'en 2023 avec l'objectif d'un CDL par EPCI.      Les CDL travaillent en étroite collaboration avec les services de gestion comptable (SGC) de la DGFiP qui assurent, comme auparavant, la gestion budgétaire et comptable des collectivités.    Le CDL est un cadre itinérant susceptible d'avoir plusieurs lieux de travail. Sous réserve de l'accord de l'ordonnateur, il est installé en priorité dans les locaux de l'EPCI ou parfois dans une des collectivités membres de son portefeuille.      La mise en place de ce nouvel interlocuteur permet :         d'offrir des prestations sur mesure, adaptées au plus près des besoins de chaque collectivité ;       de proposer une gratuité, une objectivité et une neutralité de la prestation ;       de faciliter la prise de contact et une réactivité accrue grâce à un interlocuteur privilégié pour l'élu local.           Le CDL peut être amené à dispenser plusieurs types de conseils, notamment :       conseil budgétaire et comptable (conseil à l'élaboration budgétaire, sensibilisation à la maîtrise des risques, information sur les nouveautés...) ;       conseil en matière de dépenses et de recettes (promotion de la dématérialisation, restitutions du contrôle hiérarchisé de la dépense, conseil en optimisation du recouvrement, rationalisation de l'organisation des régies....) ;       conseil financier et fiscal (réalisation et présentation des analyses financières, recherche de solutions de cofinancement, simulations fiscales...) ;       conseil économique et patrimonial (conseil sur projet d'investissement, projet d'aménagement du territoire...).",
"Etre conseillé sur des sujets complexes en gestion financière, budgétaire, comptable et fiscale (MRCDP)",https://aides-territoires.beta.gouv.fr/aides/9b7e-conseil-aux-decideurs-publics/,Direction Générale des Finances Publiques (DGFiP),"Communes;Intercommunalités / Pays;Départements;Régions;Établissements publics (écoles, bibliothèques…) / Services de l'État",Ingénierie financière,,Permanente,"Mission régionale de conseil aux décideurs publics (MRCDP      Mission de conseil installée au niveau régional auprès de chaque Direction régionale des Finances publiques (DRFiP), à l'exception de la Corse et des territoires d'Outre-Mer.      La MRCDP offre des prestations pluricompétences sur des sujets à dominante financière, fiscale et économique dès lors que les enjeux des dossiers sont jugés importants, sensibles ou de dimension régionale.    Le champ de compétence des MRCDP est centré principalement sur les décideurs publics de la sphère État (préfets, ARS, rectorats, CROUS et établissements publics nationaux) et les grandes collectivités.    Cette aide à la décision auprès des grands partenaires sur des sujets complexes et/ou à forts enjeux s'articule principalement autour des 3 thèmes suivants :       l'analyse financière, fiscale ou budgétaire (études de soutenabilité) et la réalisation d'études sur la santé économique et financière d'un territoire ;       le conseil sur des montages contractuels complexes et l'expertise organisationnelle de structures ;       la proposition d'offres innovantes et l'analyse des conséquences, notamment économiques (rentabilité, étude d'impact), d'un projet d'investissement public.         La MRCDP garantit aux bénéficiaires une étude neutre, indépendante, gratuite et confidentielle.",
Etudier l'opportunité technique et économique d'une installation bois énergie,https://aides-territoires.beta.gouv.fr/aides/6ae9-etudier-lopportunite-technique-et-economique-/,Syndicat Départemental d'Energies du Calvados (SDEC ENERGIE),Communes;Intercommunalités / Pays,Ingénierie technique,,Permanente,L'étude est réalisée par le SDEC ENERGIE qui prend en charge l'intégralité de son coût.    Elle porte sur l'opportunité de réaliser un projet bois énergie pour le chauffage de bâtiments publics.,
Etudier l'opportunité technique et économique d'une installation solaire en toiture,https://aides-territoires.beta.gouv.fr/aides/d3c8-realiser-letude-energetique-dun-batiment-etud/,Syndicat Départemental d'Energies du Calvados (SDEC ENERGIE),Communes;Intercommunalités / Pays,Ingénierie technique,,Permanente,L'étude est réalisée par le SDEC ENERGIE qui prend en charge l'intégralité de son coût (estimé à 1400€).    Elle porte sur l'opportunité de réaliser un projet solaire thermique ou photovoltaïque en toiture de bâtiments publics.,
Etudier la rénovation énergétique d'un bâtiment,https://aides-territoires.beta.gouv.fr/aides/9d50-copie-12h10-etudier-la-faisabilite-dun-projet/,Syndicat Départemental d'Energies du Calvados (SDEC ENERGIE),Communes;Intercommunalités / Pays,Subvention;Ingénierie financière,,Permanente,"Étude de type ""audit énergétique"",  réalisée par un cabinet spécialisé  sur les conditions d'amélioration de la performance énergétique d'un bâtiment ou d'un projet de rénovation. Cette aide exclut les études réglementaires.      Aide bonifiée à 80% du reste à charge, pour un plafond de 6000€/étude pour les bâtiments suivis par le CEP de niveau 2.",
Evaluer l'impact des projets d'aménagement (GES Urba),https://aides-territoires.beta.gouv.fr/aides/6ef6-evaluer-limpact-des-projets-damenagement/,Cerema,Communes;Intercommunalités / Pays;Entreprises privées,Ingénierie technique;Ingénierie Juridique / administrative,Oui,Permanente,"Les enjeux de qualité de l'air et de réduction des gaz à effet de serre sont cruciaux dans un contexte de changement climatique et de la nécessaire adaptation des territoires. Le Cerema a conçu une application d'aide à la décision pour évaluer des scénarios d'aménagement sous l'angle de la consommation énergétique et des émissions de gaz à effet de serre, afin de mieux intégrer ces enjeux dans la planification :         GES Urba         L'application en ligne GES URBA est gratuite et ouverte à tous. Elle a été développée sur la base des outils d'aide à la décision GES SCoT et GES PLU, et est aujourd'hui disponible en version test.    Conçue pour aider les collectivités à s'inscrire dans la démarche de réduction des émissions de GES,  elle permet d'évaluer les projets d'urbanisme en intégrant de nombreux paramètres qui ont une influence sur les émissions de Gaz à effet de serre (GES) et les consommations d'énergie.    GES URBA explore les thématiques pour lesquelles le document d'urbanisme dispose de leviers d'action : réhabilitation du bâti et normes de construction neuve, mobilité, développement des énergies renouvelables et des réseaux de chaleur, renouvellement urbain, consommation foncière et stockage carbone, usage des bâtiments.    L'application s'adresse aussi bien aux collectivités (domaines de l'urbanisme et de l'énergie/climat notamment) qu'aux agences d'urbanisme ou aux bureaux d'études. Les utilisateurs peuvent construire des scénarios et modifier différents paramètres pour en déterminer l'impact en termes d'émissions de GES et d'énergie. L'interface est constituée d'un ensemble de questions auxquelles l'utilisateur apporte des réponses qualitatives ou quantitatives.           Des éléments de diagnostic du territoire intégrant de nombreuses thématiques pour faciliter l'élaboration d'un scénario fil de l'eau (consommation des logements, mobilité des personnes, réseaux de chaleur et EnR déjà présentes sur le territoire...)              Une analyse à différentes échelles (SCoT, PLU et PLUi),              La possibilité de travailler à différentes échelles : pôles, ensemble du territoire en fonction de l'avancement du projet et de la finesse souhaitée des hypothèses,              Articuler plusieurs thématiques et avoir une vision globale sur l'enjeu énergie-climat,              Un accompagnement en ligne, notamment pour la collecte des données.                Découvrir l'application maintenant",
Faciliter le développement commercial et l’attractivité économique des cœurs de ville,https://aides-territoires.beta.gouv.fr/aides/3b76-developper-des-foncieres-locales-repondant-a-/,Banque des Territoires,"Communes;Collectivités d'outre-mer à statuts particuliers;Entreprises publiques locales (Sem, Spl, SemOp)",Ingénierie technique;Ingénierie financière,,Permanente,La Banque des Territoires aide les collectivités à la mise en place de foncières dédiées à la revitalisation des cœurs de ville.    Cette offre vous accompagne dans les opérations de restructuration immobilière des commerces et dans la création de locaux d'activités. Elle se caractérise par :       un soutien en ingénierie       des prises de participations en fonds propres et quasi-fonds propres       le renforcement en fonds propres et quasi-fonds propres de SEM et filiales de SEM intégrant une activité de foncière de redynamisation.,
Faire appel à un Atelier Chantier d’Insertion : entretien et rénovation du patrimoine bâti,https://aides-territoires.beta.gouv.fr/aides/5bcd-faire-appel-a-un-atelier-chantier-dinsertion-/,ID77,Communes;Intercommunalités / Pays,Ingénierie technique,,Permanente,"Objectif :      Favoriser l'insertion professionnelle grâce à des travaux d'intérêt social avec l'agence départementale d'insertion, Initiatives77.       A propos d'Initiatives77 :      Créé en 1991, Initiatives77 est un organisme associé du Conseil Départemental de Seine-et-Marne chargé de promouvoir toutes les actions de nature à favoriser l'insertion professionnelle : l'accès à l'emploi, la formation et l'insertion par le logement.       Notre offre de service :      Dans le cadre de ses Ateliers et Chantiers d'Insertion (ACI), Initiatives77 entretient et rénove votre patrimoine (mise en accessibilité, lavoirs, écoles, murs de cimetières, puits, monuments à préserver...). Ces chantiers vous permettent de valoriser votre engagement pour :       L'accompagnement et la formation des personnes éloignées du marché du travail,       La rénovation ou l'embellissement de votre territoire.         Comment préparer l'intervention d'un ACI avec Initiatives77 ?      L'Atelier et Chantier d'Insertion s'organise en 4 étapes :    1. La co-construction du projet avec Initiatives77    2. La validation des estimatifs et signature d'une convention,    3. Le lancement du chantier assuré par un Chef de chantier (salarié d'Initiatives77),    4. Le suivi du chantier et bilan de fin d'intervention.         Quelles sont les modalités d'accueil d'un ACI avec Initatives77 ?      En règle générale, la collectivité achète les matériaux et prend à sa charge l'accueil du chantier d'insertion à savoir :         Les repas des salariés en insertion et du Chef de chantier (entre 8 et 12 salariés), via la cantine scolaire, par exemple,       Les lieux de vie (vestiaire, accès à des sanitaires, salle de restauration...)       Les lieux de stockage d'outils et des matériaux.      Si les travaux ont une durée de plus de 2 mois, un comité de pilotage est composé le temps du chantier.    Le coût d'intervention d'un chantier d'insertion est de 1.001€ par semaine (hors matériaux, matériels et logistique    d'accueil).    Si la collectivité locale ne peut pas fournir les repas, ils lui seront facturés à hauteur de 8€00 par personne et par repas.",
Faire appel à un Atelier et Chantier d’Insertion : aménagement d'intérieur (locaux et logements),https://aides-territoires.beta.gouv.fr/aides/08be-faire-appel-a-un-atelier-chantier-dinsertion-/,ID77,Communes;Intercommunalités / Pays,Ingénierie technique,,Permanente,"Favoriser l'insertion professionnelle grâce à des travaux d'intérêt social avec l'agence départementale d'insertion, Initiatives77.",
Faire appel à un Atelier et Chantier d’Insertion : restauration et aménagement du milieu naturel,https://aides-territoires.beta.gouv.fr/aides/ed52-faire-appel-a-un-atelier-chantier-dinsertion-/,ID77;Agence départementale d'insertion - Initiatives77,Communes;Intercommunalités / Pays,Ingénierie technique,,Permanente,"Favoriser l'insertion professionnelle grâce à des travaux d'intérêt social avec l'agence départementale d'insertion, Initiatives77.    A propos d'Initiatives77 : Créé en 1991, Initiatives77 est un organisme associé du Conseil Départemental de Seine-et-Marne chargé de promouvoir toutes les actions de nature à favoriser l'insertion professionnelle : l'accès à l'emploi, la formation et l'insertion par le logement.    Notre offre de service :  Dans le cadre de ses Ateliers et Chantiers d'Insertion (ACI), Initiatives77 crée des promenades (chemin en grave, platelage...), aménage des espaces verts et intervient dans vos espaces protégés (ENS, zones humides).       Ces chantiers vous permettent de valoriser votre engagement pour :           L'accompagnement et la formation des personnes éloignées du marché du travail       La rénovation ou l'embellissement de votre environnement et patrimoine naturel.      Plus d'infos  https://initiatives77.org/offre-services-collectivites-locales/       Comment préparer l'intervention d'un ACI avec Initiatives77 ?      L'Atelier et Chantier d'Insertion s'organise en 4 étapes :         La co-construction du projet avec Initiatives77,       La validation des estimatifs et signature d'une convention,       Le lancement du chantier assuré par un Chef de chantier (salarié d'Initiatives77),       Le suivi du chantier et bilan de fin d'intervention.         Quelles sont les modalités d'accueil d'un ACI avec Initatives77 ?      En règle générale, la collectivité achète les matériaux et prend à sa charge l'accueil du chantier d'insertion à savoir :         Les repas des salariés en insertion et du Chef de chantier (entre 8 et 12 salariés), via la cantine scolaire, par exemple,       Les lieux de vie (vestiaire, accès à des sanitaires, salle de restauration...)       Les lieux de stockage d'outils et des matériaux.       Si les travaux ont une durée de plus de 2 mois, un comité de pilotage est composé le temps du chantier.         Conditions financières      Le coût d'intervention d'un chantier d'insertion est de 1001 euros par semaine (hors matériaux, matériels et logistique d'accueil). Si le bénéficiaire ne peut pas fournir les repas 8 euros/ personne / repas seront facturés.",
