Nom,Lien,Financeurs,Bénéficiaire,Types d'aides,AAP/AMI,Récurrence,Descriptif,Date Clôture
Mobiliser les partenaires de l'atelier d'urbanisme en Livradois-Forez pour un accompagnement sur mesure !,https://aides-territoires.beta.gouv.fr/aides/3720-atelier-durbanisme-en-livradois-forez/,Parc naturel régional Livradois-Forez (PNR),Communes;Intercommunalités / Pays,Ingénierie technique,,Permanente,"Dispositif d'accompagnement des collectivités dans leurs projets d'aménagement dans les domaines de l'urbanisme, de l'architecture, du paysage et dans la revitalisation des centres-bourgs.",
Mobiliser un établissement public foncier,https://aides-territoires.beta.gouv.fr/aides/f989-mobiliser-un-etablissement-public-foncier/,Établissements publics fonciers d'Etat et établissements publics fonciers locaux (EPF/EPFL),Communes;Intercommunalités / Pays,Autre aide financière;Ingénierie technique;Ingénierie financière;Ingénierie Juridique / administrative,,Permanente,"Les Établissements publics fonciers (EPF) vous proposent de contribuer aux études pré-opérationnelles, de réaliser les acquisitions foncières (négociation amiable ou par le biais de procédures juridiques de type préemption / expropriation), puis d'assurer le portage foncier (gestion, sécurité, gardiennage, etc.) et les opérations de proto-aménagement (déconstruction des bâtiments existants, dépollution, etc.). A l'issue de la convention, le foncier est rétrocédé à la collectivité territoriale ou directement à l'aménageur retenu par la collectivité (à prix coûtant voire avec une minoration). L'EPF assure également une mission de conseil auprès des collectivités membres pour l'élaboration de leur stratégie d'intervention foncière.",
Obtenir de l'aide en ingénierie,https://aides-territoires.beta.gouv.fr/aides/b3c6-aide-ingenierie-aux-collectivites-locales-du-/,Direction départementales des territoires du Jura (DDT),Communes;Intercommunalités / Pays;Départements;Associations;Agriculteurs,Ingénierie technique;Ingénierie Juridique / administrative,Oui,Permanente,"La Direction départementale des Territoires du département du Jura (39) propose aux collectivités locales une aide en ingénierie pour leurs projets. Par exemple, les aiguiller dans les procédures, dans la recherche de financement ou encore les orienter techniquement.",
Obtenir des investissements grâce aux titres participatifs,https://aides-territoires.beta.gouv.fr/aides/1df4-titres-participatifs-a-impact-social-emis-par/,Banque des Territoires,"Communes;Intercommunalités / Pays;Collectivités d'outre-mer à statuts particuliers;Associations;Entreprises privées;Entreprises publiques locales (Sem, Spl, SemOp);Établissements publics (écoles, bibliothèques…) / Services de l'État",Autre aide financière;Ingénierie financière,,Permanente,"________________________________________________________________________               Les financements décrits dans cette section respectent la réglementation relative aux aides d'Etat et n'emportent donc pas d'éléments d'aide.       ________________________________________________________________________      Dans le cadre de la loi ELAN qui permet aux partenaires et bailleurs sociaux de se doter de titres participatifs en fonds propres, la Banque des Territoires intervient aux côtés des organismes en tant qu'investisseur. Un dispositif sécurisé et personnalisable.",
Obtenir des renseignements juridiques et financiers - SRJF,https://aides-territoires.beta.gouv.fr/aides/f991-service-de-renseignements-juridiques-et-finan/,Banque des Territoires,Communes;Intercommunalités / Pays;Collectivités d'outre-mer à statuts particuliers,Ingénierie Juridique / administrative,,Permanente,"Le service de renseignements juridiques et financiers (SRJF) proposé par la Banque des Territoires vous permet de bénéficier d'une réponse immédiate et personnalisée sur vos questions concernant les conditions juridiques et financières des projets territoriaux.    La SRJF est un service gratuit pour les communes de moins de 20 000 habitants, les communes nouvelles et les intercommunalités.",
Obtenir un appui pour faire émerger des stratégies globales de territoires,https://aides-territoires.beta.gouv.fr/aides/0519-obtenir-un-appui-pour-faire-emerger-des-strat/,Direction départementale des Territoires et de la Mer (DDTM) du Finistère,Communes;Intercommunalités / Pays,Ingénierie technique;Ingénierie financière;Ingénierie Juridique / administrative,,Permanente,"Du fait de leur proximité avec les élus et de leur connaissance des territoires, les services appropriés selon le domaine concerné, ou en cas de domaines multiples l'Atelier « Inter-services Territoires Politiques Publiques, Partenaires et Projets » (AIT4P) de la DDTM 29, sont en capacité d'apporter localement une réponse adaptée à chaque collectivité, prenant en compte les objectifs des dispositifs d'aménagement du territoire et les principes généraux du développement durable.    Cette aide se matérialise par un appui en ingénierie technique, juridique, et financier. Un fonctionnement en mode projet et des apports méthodologiques contribuent à faire émerger des stratégies territoriales qui peuvent ensuite se traduire par une contractualisation ou la mise en place d'outils réglementaires. Et suivant le besoin identifié, elle peut revêtir différentes formes : appui méthodologique, observation pré-diagnostic, assistance à la rédaction d'un cahier des charges en vue d'une consultation, conseil amont, analyse observatoire de faisabilité...",
Obtenir un appui technique de proximité à la mise en oeuvre des politiques publiques prioritaires et un accompagnement amont sur les procédures réglementaires associées,https://aides-territoires.beta.gouv.fr/aides/ba53-obtenir-un-appui-technique-de-proximite-a-la-/,Direction départementale des Territoires et de la Mer (DDTM) du Finistère,Communes;Intercommunalités / Pays,Ingénierie technique;Ingénierie financière;Ingénierie Juridique / administrative,,Permanente,"Les services appropriés selon le domaine concerné, ou en cas de domaines multiples l'Atelier « Inter-services Territoires Politiques Publiques, Partenaires et Projets » (AIT4P) de la Direction Départementale des Territoires et de la Mer du Finistère, sont les interlocuteurs de proximité des élus qui souhaitent être accompagnés et soutenus dans la mise en oeuvre de projets relevant des     politiques publiques prioritaires    suivantes :       aménagement de bourgs          transition énergétique          qualité de l'eau          publicité          sécurité routière          bâtiment durable et accessibilité          biodiversité          risques          urbanisme         Cette aide se matérialise par un conseil global en aménagement, des interventions ponctuelles ou une mise en réseau.    Suivant le besoin identifié, elle peut revêtir différentes formes : appui méthodologique, observation prédiagnostic, conseil amont, analyse observatoire de faisabilité...       Le       s différents services apportent dans une logique de simplification administrative, un conseil stratégique amont tenant compte du contexte local et des particularités du projet, et permet d'aplanir la complexité des procédures inhérentes aux projets d'aménagement et de développement économique.      Après un examen sur la base d'une question et pré-dossier du porteur de projet, l'Atelier délivre au bénéficiaire un avis préalable sur les procédures applicables et les délais induits ainsi qu'une synthèse des informations utiles",
Obtenir un appui technique de proximité à la mise en œuvre des politiques publiques prioritaires,https://aides-territoires.beta.gouv.fr/aides/4d2f-appui-technique-de-proximite-a-la-mise-en-uvr/,DDT de la Lozère,Communes;Intercommunalités / Pays,Ingénierie technique;Ingénierie financière;Ingénierie Juridique / administrative,,Permanente,"La direction départementale des Territoires de la Lozère est l'interlocuteur de proximité des élus qui souhaitent être accompagnés et soutenus dans la mise en œuvre de projets relevant des politiques publiques prioritaires suivantes : aménagement de bourgs, transition énergétique, publicité, sécurité routière, bâtiment durable et accessibilité, risques, urbanisme.    Cette aide se matérialise par un conseil global en aménagement, des interventions ponctuelles ou une mise en réseau. Suivant le besoin identifié, elle peut revêtir différentes formes : pré-diagnostic ou diagnostic, assistance à la rédaction d'un cahier des charges en vue d'une consultation, conseil amont, étude de faisabilité.       Exemples de projets réalisés grâce à cette aide :         aménagements d'espaces publics ;       rénovation thermique ;       agendas d'accessibilité programmée ;       diagnostics publicité ;       diagnostics de sécurité routière ;       aires d'accueil des gens du voyage ;       plans communaux de sauvegarde.",
Obtenir un conseil en stratégie patrimoniale relative aux bâtiments éducatifs,https://aides-territoires.beta.gouv.fr/aides/e3ad-obtenir-un-conseil-en-strategie-patrimoniale-/,Banque des Territoires,Communes;Intercommunalités / Pays;Collectivités d'outre-mer à statuts particuliers,Ingénierie technique;Ingénierie financière,,Permanente,La Banque des Territoires accompagne les collectivités pour définir leur politique patrimoniale des bâtiments éducatifs.      Les experts de la Banque des Territoires fournissent une vision holistique et durable de la modernisation des écoles en proposant :           un appui à l'élaboration d'une stratégie patrimoniale des bâtiments scolaires          un accompagnement dans des expérimentations de type « école du futur ».          une aide juridique et financière au montage d'opérations relatives aux bâtiments scolaires –notamment pour leur rénovation énergétique ou la réalisation de bâtiments avec utilisation partagée.,
"Obtenir un financement d’études, d’un suivi-animation et de l'évaluation des opérations programmées de l'habitat",https://aides-territoires.beta.gouv.fr/aides/obtenir-financement-pvd-habitat/,Agence Nationale de l'Habitat (ANAH),Communes;Intercommunalités / Pays,Ingénierie technique,,Permanente,"Vous souhaitez lancer ou vous bénéficiez déjà d'une opération programmée de l'habitat et avez besoin d'un accompagnement pour la réalisation d'études préalables ou la mise en oeuvre du dispositif.     Vous pouvez solliciter un co-financement à hauteur de 50% d'un montant de dépense plafonné pour les actions suivantes :       Les études préalables et pré-opérationnelles pour repérer une problématique, définir une stratégie opérationnelle, étudier la faisabilité et définir les modalités de mise en œuvre.       La mise en oeuvre des opérations et le co-financement d'une équipe de suivi-animation du programme lorsqu'il s'agit d'une OPAH RU (35 % en cas d'OPAH)          L'évaluation du programme, via le co-financement d'étude d'évaluation des actions menées",01/01/2026
"Obtenir une minoration foncière complémentaire dans le cadre de projets ""Petites Villes de Demain"" ou ""Action Cœur de Ville""",https://aides-territoires.beta.gouv.fr/aides/560e-recyclage-foncier-et-friches/,Établissement public foncier local de l'Oise et Aisne (EPFLO),Communes;Intercommunalités / Pays;Départements;Régions,Subvention;Autre aide financière;Ingénierie technique;Ingénierie financière;Ingénierie Juridique / administrative,,Ponctuelle,"Objectif    : Les projets de revitalisation de centres villes portent sur des fonciers complexes rendant difficile la réalisation des projets. Afin d'accompagner les projets ""Petites Villes de Demain"" et  ""Actions Cœur de Ville"" sur le volet foncier, une prise en charge spécifique du prix de revient peut intervenir, complémentairement à une ou plusieurs minorations foncières (logement aidé, recyclage foncier, valorisation du patrimoine bâti).       Modalités    :    -    Les opérations éligibles sont celles situées dans un périmètre d'opération de revitalisation de territoire (ORT), liés aux conventions ""Petites Villes de Demain"" ou ""Action Cœur de Ville"".    -    Minoration de 25% du prix de revient HT, complémentairement à une ou plusieurs minorations, dans la limite de 50% du prix de revient HT.    -    Attribution de la minoration pour des projets entrant dans le cadre du PPI (sauf opération bénéficiant d'un bail emphytéotique EPFLO).",31/12/2023
"Participer à des réseaux, des rencontres et des échanges en matière d'urbanisme",https://aides-territoires.beta.gouv.fr/aides/0e24-participer-a-des-reseaux-des-rencontres-et-de/,Direction départementale des Territoires et de la Mer (DDTM) du Finistère,Communes;Intercommunalités / Pays,Ingénierie technique;Ingénierie financière;Ingénierie Juridique / administrative,,Permanente,"Le service Aménagement de la DDTM 29 anime plusieurs réseaux de praticiens en Finistère :           le ""club ADS"" : à destination des instructeurs de l'application du droit des sols des collectivités et des experts de la DDTM ;          le ""club planification "" : à destination des agents en charge de la planification urbaine - SCoT, PLU(i) - et de l'urbanisme opérationnel dans les EPCI, des bureaux d'études en charge de ces documents et des structures « personnes publiques associées »          le club ECOQUARTIER, à destination de tous les acteurs de la démarche Ecoquartier au niveau local, national, voire européen          Les objectifs poursuivis par ces réseaux sont :        d'échanger sur les politiques publiques          des dernières évolutions législatives et jurisprudentielles          de partager les bonnes pratiques et les retours d'expérience          Chaque réseau s'appuie sur :        plusieurs rencontres par an          une plateforme régionale d'échanges documentaires          une expertise ponctuelle possible sur un besoin particulier exprimé par une collectivité.",
"Participer à des réseaux, des rencontres et des échanges en urbanisme",https://aides-territoires.beta.gouv.fr/aides/0477-animation-de-reseaux-de-rencontres-dechanges-/,DDT du Tarn-et-Garonne,Communes;Intercommunalités / Pays,Ingénierie technique,,Permanente,"La DDT82 anime plusieurs réseaux de praticiens en Tarn-et-Garonne :             le ""club ADS"" : à destination des instructeurs de l'application du droit des sols en collectivités et DDT ;          le ""club planif' "" : à destination des agents en charge de la planification urbaine - SCoT, PLU(i)- et de l'urbanisme opérationnel dans les EPCI.            Les objectifs poursuivis par ces réseaux sont :             d'échanger sur les politiques publiques, les dernières évolutions législatives et jurisprudentielles ;          de partager les bonnes pratiques et les retours d'expérience ;            Chaque réseau s'appuie sur :             plusieurs rencontres par an ;          une plateforme d'échanges documentaire ;          une expertise ponctuelle possible sur un besoin particulier exprimé par une collectivité.",
Participer à un Atelier rural d’urbanisme (ARU),https://aides-territoires.beta.gouv.fr/aides/50bf-atelier-rural-durbanisme-aru/,Parc naturel régional des VOLCANS d'AUVERGNE (PNR),Communes;Intercommunalités / Pays,Ingénierie technique,,Permanente,"L'ARU un collectif technique intervenant gratuitement dans les domaines de l'urbanisme et du paysage.    Animé par le PNR des Volcans d'Auvergne, il s'adresse aux communes et aux EPCI ayant approuvé la Charte  2013 > 2025 du Parc.    Il intervient auprès des collectivités en tant que structure de conseil et d'aide à la définition de projet. Il propose un appui technique sur :         la réflexion préalable à l'élaboration de documents de planification (SCoT, PLU/PLUi) : sensibilisation, identification des enjeux, définition des objectifs poursuivis, ... ;       l'approche stratégique des projets d'urbanisme opérationnel (requalification des espaces publics, entrée de bourg, ...) : définition des besoins et des enjeux, parti pris paysager, estimation budgétaire,...      Nota : l'ARU est un outil de conseil et d'aide à la décision. Par conséquent, ses actions ne se situent pas dans le champ concurrentiel. L'ARU ne se substitue pas aux bureaux d'études et structures d'ingénierie intervenant sur le territoire.",
Planter sur les biens communaux et intercommunaux,https://aides-territoires.beta.gouv.fr/aides/161d-planter-sur-les-biens-communaux-et-intercommu/,Conseil départemental de la Vendée,Communes;Intercommunalités / Pays,Subvention;Ingénierie technique,,Permanente,"Dans le cadre de son plan Vendée Biodiversité et Climat, le Département développe des actions volontaristes, innovantes et pragmatiques. C'est dans cet esprit que s'inscrit l'action « Planter 600 000 arbres » en collaboration avec les Communes et les Établissements Publics de Coopération Intercommunale (E.P.C.I.).       L'intervention du Département porte sur :         la réalisation des plantations,       la période de parachèvement des plantations (de la plantation jusqu'au constat de reprise des végétaux, soit 1 an au maximum),       la période de confortement des plantations (c'est-à-dire l'entretien des végétaux pendant 1 an à compter du constat de reprise des végétaux), soit une période totale de deux ans maximum à compter de la réalisation des plantations jusqu'au transfert de leur propriété à la Collectivité.      Cette intervention revêt le caractère d'une subvention en nature.    Les plantations d'arbres et leur entretien seront prises en charge directement par le Département.",
Porter des biens (baux longue durée),https://aides-territoires.beta.gouv.fr/aides/07f5-acheter-a-long-terme/,Établissement public foncier local d'Alsace (EPFL),Communes;Intercommunalités / Pays;Départements;Régions,Ingénierie Juridique / administrative,,Permanente,"L'EPF d'Alsace propose, lorsque cela semble nécessaire, la mise en place de baux longue durée. Ces baux ont un double objectif. Le  premier est de permettre la réalisation de travaux d'aménagement, de réparations, d'entretien, d'amélioration et/ou de réhabilitation  par la collectivité pendant le portage. Le deuxième est d'assurer une gestion à long terme du foncier.           Mise en œuvre      L'EPF d'Alsace peut mettre en pratique 3 types de baux longue durée :       Le bail emphytéotique administratif dit «BEA» ;       Le bail à construction ou à réhabilitation ;       Le bail emphytéotique avec un tiers ;",
"Poser une borne de recharge pour véhicules électriques, vélos électriques ou une station hydrogène",https://aides-territoires.beta.gouv.fr/aides/c36b-realiser-une-installation-photovoltaique-en-t/,Syndicat Départemental d'Energies du Calvados (SDEC ENERGIE),Communes;Intercommunalités / Pays,Subvention;Ingénierie technique;Ingénierie Juridique / administrative,,Permanente,"Fourniture et pose de la borne ou de la station, raccordement et aménagement  des places de recharges.      Cette aide intervient à la demande des collectivités qui ont transféré leur compétence ""infrastructure de charge"" au SDEC ENERGIE.",
Produire des logements,https://aides-territoires.beta.gouv.fr/aides/1df0-gerer-les-risques-naturels-et-technologiques/,Établissement Public Foncier des Hauts-de-France (EPF),"Communes;Intercommunalités / Pays;Départements;Régions;Établissements publics (écoles, bibliothèques…) / Services de l'État",Autre aide financière;Ingénierie technique;Ingénierie financière;Ingénierie Juridique / administrative,,Permanente,"L'EPF Hauts de France contribue à répondre aux besoins en logements en     recyclant le foncier nécessaire à leur production.      L'établissement intervient autant sur les marchés tendus pour mobiliser rapidement des fonciers notamment pour la production d'une offre de logements sociaux, sur les marchés détendus pour recréer les conditions d'une meilleure attractivité pour les opérateurs, au sein des quartiers anciens dégradés et paupérisés en requalifiant l'habitat obsolète et insalubre et en restructurant l'offre et aussi sur des fonciers pollués où les coûts de traitement des pollutions obère la faisabilité économique pour des acteurs du secteur privé.    L'EPF engage donc les acquisitions nécessaires à la maîtrise foncière de l'assiette définie, assure le traitement des éventuelles sources de pollution et si nécessaire déconstruit les biens. Il peut également accompagner et conseiller la collectivité dans l'élaboration d'un cahier des charges de consultation destiné à sélectionner le futur opérateur. Dans certains cas, l'EPF peut minorer le prix de vente des sites sur lesquels il est intervenu au titre de la production de logements.       Projets éligibles      Sont éligibles à l'intervention de l'EPF les opérations des collectivités dédiées à la production de logements.       Dépenses éligibles      -Acquisition et portage foncier      -Etudes préalables (capacité, techniques)    -Traitement des déchets et des pollutions    -Travaux de déconstruction       Montant de l'aide :      Ingénierie prise en charge à 100%      Jusqu'à 80% du coût des études    Jusqu'à 80% du coût de l'opération travaux    Minoration foncière",
Préparer un projet de maitrise foncière,https://aides-territoires.beta.gouv.fr/aides/0982-cofinancer-des-etudes-pour-preparer-laction-f/,Établissement public foncier local de l'Oise et Aisne (EPFLO),Communes;Intercommunalités / Pays;Départements;Régions,Ingénierie technique;Ingénierie financière;Ingénierie Juridique / administrative,,Permanente,"L'Établissement Public Foncier Local des territoires Oise et Aisne accompagne ses adhérents pour la mise en œuvre de projet d'acquisitions foncière entrant dans le cadre du Programme Pluriannuel d'Intervention 2019-2023 : habitat, revitalisation d'un centre, développement économique, résorption de friches, commerce de proximité, équipement de santé, dents creuses...    Cette phase d'ingénierie et de conseil en amont d'une potentielle intervention foncière se fait à titre gratuit. Pour mieux préparer l'action foncière, un cofinancement d'étude peut-être accordé (voir page dédiée à cette aide).    Pour les collectivités non adhérentes, il peut être sollicité un RDV avec l'EPFLO pour échanger sur vos projets et la démarche d'adhésion.",01/06/2023
"Préserver et restaurer le patrimoine mobilier protégé (statuaire, tableau,…)",https://aides-territoires.beta.gouv.fr/aides/f6a1-preserver-et-restaurer-le-patrimoine-mobilier/,ID77,Communes,Ingénierie technique,,Permanente,Permettre aux communes et aux particuliers de conserver et de protéger des œuvres et objets d'art :           Expertise          Diagnostic          Préconisations          Repérage in situ des antiquités et objets d'art concernés.         Prestation assurée par la Direction des Affaires Culturelles.    Co-financement possible sur la restauration.,
Préserver le patrimoine communal des chemins ruraux (PDIPR) et établir des liaisons douces,https://aides-territoires.beta.gouv.fr/aides/c650-preserver-le-patrimoine-communal-des-chemins-/,ID77,Communes;Intercommunalités / Pays,Ingénierie technique,,Permanente,"Préserver le patrimoine communal des chemins ruraux, leur maillage, la prise en compte des déplacements doux :           Accompagnement technique pour l'inventaire des chemins ruraux sur le territoire communal          Fourniture d'un plan, d'une liste et d'un modèle de délibération pour le Conseil municipal          Inscription des chemins par délibération du Conseil départemental          Préconisations pour la prise en compte de la biodiversité dans la restauration du petit patrimoine bâti (lavoirs, ponceaux, passerelles, puits, vieux murs, etc.), et pour la création/restauration du patrimoine naturel (haies, vergers, mares, etc.)          Accompagnement technique pour l'étude des propositions dans les devis d'entreprises          Accompagnement pour le suivi de chantiers (dont chantiers d'insertions avec Initiative 77)          Présence des agents du Département aux réunions          Réunions de travail sur des thématiques particulières à la demande, notamment sur le terrain",
Raccorder de nouveaux services au réseau d'éclairage public,https://aides-territoires.beta.gouv.fr/aides/8db0-raccorder-de-nouveaux-services-au-reseau-decl/,Syndicat Départemental d'Energies du Calvados (SDEC ENERGIE),Communes,Subvention;Ingénierie technique,,Permanente,"Les services pouvant être raccordés au réseau d'éclairage public sont des systèmes de panneaux à messages variables, de vidéo-protection, de sonorisation ou de mesures des conditions atmosphériques (sur délibération du Bureau Syndical).      Les dépenses éligibles comprennent l'étude, la fourniture et la pose des systèmes.      Cette aide est conditionnée au transfert de la compétence éclairage public.",
Reconstruire la voirie suite à des intempéries,https://aides-territoires.beta.gouv.fr/aides/588c-aider-a-la-reconstruction-de-la-voirie-face-a/,Conseil départemental de l'Aude,Communes,Subvention;Ingénierie technique,,Permanente,L'objectif du Département de l'Aude est d'aider à la reconstruction de la voirie communale sinistrée et aux dépendances suite à la survenance d'événements climatiques ou géologiques de très grande ampleur.,
